{
  "actionId": "fixture:widget_update:assignee_autocomplete:spaces/AAA/messages/WIDGET:2026-06-29T18:30:00Z",
  "actionType": "widget_update",
  "methodName": "assignee_autocomplete",
  "actor": {
    "name": "users/123",
    "displayName": "Ada Lovelace",
    "type": "HUMAN"
  },
  "eventTime": "2026-06-29T18:30:00Z",
  "parameters": {
    "autocomplete_widget_query": "ada",
    "widget": "assignee"
  },
  "formInputs": {
    "assignee": {
      "kind": "user_picker",
      "value": [
        {
          "name": "users/123",
          "displayName": null,
          "type": null
        }
      ],
      "values": ["users/123"],
      "raw": {
        "stringInputs": {
          "value": ["users/123"]
        }
      }
    }
  },
  "selectedUsers": [
    {
      "name": "users/123",
      "displayName": null,
      "type": null
    }
  ],
  "selectedSpaces": [],
  "validationErrors": [],
  "systemNotes": [
    "System Note: Ada Lovelace (users/123) updated widget action \"assignee_autocomplete\" at 2026-06-29T18:30:00Z.",
    "System Note: Action parameters: autocomplete_widget_query=ada, widget=assignee.",
    "System Note: Form field assignee selected users/123."
  ],
  "raw": {
    "action": {
      "actionMethodName": "assignee_autocomplete"
    },
    "common": {
      "invokedFunction": "assignee_autocomplete",
      "parameters": {
        "autocomplete_widget_query": "ada",
        "widget": "assignee"
      },
      "formInputs": {
        "assignee": {
          "stringInputs": {
            "value": ["users/123"]
          }
        }
      }
    },
    "slashCommand": null,
    "appCommandMetadata": null,
    "dialogEventType": null
  }
}
